Ενημερωμένο εξάρτημα,Κύριος λόγος αναβάθμισης,Γεωμετρικές διαφορές σε σχέση με την προηγούμενη έκδοση,Σύντομη περιγραφή λειτουργίας της αναβάθμισης (20-100 λέξεις)
Halo,Απόδοση – Τοπικό φορτίο,Η τοπική λεπτομέρεια γύρω από τις βάσεις του Halo έχει αναθεωρηθεί με μειωμένο πτερύγιο,Οι αλλαγές στη διαχείριση της ροής γύρω από το κόκπιτ μεταβάλλουν το φορτίο σε αυτή την περιοχή και επηρεάζουν τη ροή πίσω από αυτή.
Σώμα δαπέδου,Απόδοση – Τοπικό φορτίο,Το κύριο σώμα του δαπέδου εξελίχθηκε ελαφρώς με νέα φράγματα και άκρο,Τα αναθεωρημένα σχήματα βελτιώνουν τη ροή κάτω από το δάπεδο, αυξάνοντας το τοπικό κάθετο φορτίο στην κάτω επιφάνεια.
Φράγματα δαπέδου,Απόδοση – Τοπικό φορτίο,Τα φράγματα απέκτησαν νέα καμπυλότητα και τοπικές λεπτομέρειες,Οι αλλαγές ενισχύουν το τοπικό κάθετο φορτίο κάτω από το δάπεδο, βελτιώνοντας τη συνολική απόδοση.
Άκρο δαπέδου,Απόδοση – Τοπικό φορτίο,Μικρές τροποποιήσεις στο άκρο πτέρυγας του δαπέδου και στο εσωτερικό τμήμα,Οι νέες λεπτομέρειες στο άκρο δαπέδου συνεργάζονται με τα φράγματα για πιο καθαρή ροή προς τα πίσω.
Διαχύτης,Απόδοση – Τοπικό φορτίο,Η βάση του διαχύτη ανανεώθηκε,Τα νέα σχήματα βελτιώνουν τη ροή κάτω από το δάπεδο και αυξάνουν το τοπικό κάθετο φορτίο.
Κάλυμμα κινητήρα,Απόδοση – Τοπικό φορτίο,Αλλαγή στην καμπυλότητα του καλύμματος κινητήρα,Το αναθεωρημένο σχήμα βελτιώνει την απόδοση του δαπέδου σε συνδυασμό με τις αναβαθμίσεις στο άκρο.
Πτέρυγα δέσμης,Απόδοση – Μείωση drag,Μειωμένη γωνία πρόσπτωσης στα τμήματα της πτέρυγας δέσμης,Η χαμηλότερη επιθετικότητα μειώνει το drag ενώ διατηρεί ικανοποιητικό κάθετο φορτίο για συνολική αύξηση αποδοτικότητας.
