Γόμα (Compound),Πιθανό Χρώμα Πλαϊνού Τοιχώματος (Όταν Επιλέγεται),Κύρια Χαρακτηριστικά ,Ενδεικτικό Εύρος Θερμοκρασίας Λειτουργίας
C0, ⚪ Λευκό (Σκληρή), Πρώην C1 Η πιο σκληρή της γκάμας Για πίστες με υψηλά ενεργειακά φορτία Μέγιστη αντοχή στη θερμότητα και τις ακραίες δυνάμεις Μεγάλη διάρκεια stint λιγότερη μέγιστη απόδοση, 85°C−120°C (Βέλτιστη 100°C)
C1, ⚪ Λευκό (Σκληρή) ,Νέα για το 2023 καλύπτει το κενό μεταξύ της παλιάς C1 και C2 Κατάλληλη για πιο γρήγορες θερμές και τραχιές πίστες Συντηρητική επιλογή για νέες πίστες Παράδειγμα Zandvoort (μαζί με C2 C3), 85°C−120°C (Βέλτιστη 100°C)
C2 , ⚪ Λευκό (Σκληρή) ή 🟡 Κίτρινο (Μέση), Ευέλικτη μπορεί να είναι η σκληρότερη η μεσαία ή η μαλακότερη σε μια επιλογή τριών γομών Καλή ισορροπία απόδοσης και αντοχής Παράδειγμα Spa (μαζί με C3 C4), 85°C−115°C (Βέλτιστη 95°C)
C3 ,🟡 Κίτρινο (Μέση) ή 🔴 Κόκκινο (Μαλακή), Εξαιρετικά ευέλικτη και ευρέως χρησιμοποιούμενη Κατάλληλη για μεγάλο εύρος συνθηκών πίστες χαμηλής καταπόνησης γρήγορη προθέρμανση, 80°C−110°C (Βέλτιστη 90°C)
C4 , 🟡 Κίτρινο (Μέση) ή 🔴 Κόκκινο (Μαλακή), Σχεδιασμένη για καλή απόδοση σε πίστες χαμηλής καταπόνησης όπου απαιτείται γρήγορη προθέρμανση για άμεση μέγιστη απόδοση Καλή για κλειστές στροφές υψηλής ταχύτητας Παράδειγμα Hungaroring (μαζί με C3 C5), 80°C−105°C (Βέλτιστη 90°C)
C5 ,🔴 Κόκκινο (Μαλακή) , Η πιο μαλακή γόμα της γκάμας Σχεδιασμένη για τις πιο αργές πίστες με χαμηλή φθορά και υποβάθμιση όπου απαιτείται μέγιστη μηχανική πρόσφυση Συνήθως σε πίστες πόλης ή όπου η άσφαλτος είναι εξαιρετικά λεία, 75°C−105°C (Βέλτιστη 85°C)

